"Cluster","TermNames","TermIndices"
142,"minus-end-directed organelle transport along microtubule, negative regulation of phospholipase C-activating G-protein coupled receptor signaling pathway, negative regulation of phospholipase activity, regulation of proteinase activated receptor activity, regulation of phospholipase C-activating G-protein coupled receptor signaling pathway, negative regulation of lipase activity, negative regulation of phospholipase C activity","382, 487, 485, 925, 906, 466, 486"
143,"cellular component organization, cellular component organization or biogenesis","106, 107"
144,"myelin assembly, cellular component assembly involved in morphogenesis","399, 102"
145,"regulation of cell proliferation, cell proliferation","800, 92"
146,"cellular developmental process, cell differentiation","108, 85"
147,"cell cycle G1/S phase transition, mitotic cell cycle arrest, positive regulation of cell cycle arrest, G1/S transition of mitotic cell cycle","82, 384, 604, 264"
148,"CDP-diacylglycerol biosynthetic process, CDP-diacylglycerol metabolic process","78, 79"
149,"catabolic process, organic substance catabolic process","75, 547"
150,"cellular response to fatty acid, multicellular organismal protein metabolic process, response to alcohol, cellular response to prostaglandin stimulus, response to fatty acid, response to prostaglandin E, response to prostaglandin, cellular response to alcohol, cellular response to prostaglandin E stimulus","134, 394, 974, 149, 987, 1009, 1008, 126, 148"
151,"cell junction organization, cell-cell junction organization, cell-cell junction assembly","89, 94, 93"
152,"cardiac muscle cell development, cardiac muscle hypertrophy, physiological cardiac muscle hypertrophy, cell growth involved in cardiac muscle cell development, regulation of striated muscle cell differentiation, physiological muscle hypertrophy, regulation of cell growth involved in cardiac muscle cell development, cardiac cell development","71, 72, 572, 88, 946, 573, 796, 69"
153,"monocarboxylic acid metabolic process, oxoacid metabolic process, organic acid metabolic process, carboxylic acid metabolic process","386, 556, 540, 68"
154,"carboxylic acid biosynthetic process, organic acid biosynthetic process","66, 538"
155,"carbohydrate metabolic process, single-organism carbohydrate metabolic process","65, 1047"
156,"negative regulation of timing of catagen, insulin-like growth factor receptor signaling pathway, negative regulation of hair follicle maturation, positive regulation of melanin biosynthetic process, regulation of hair cycle by canonical Wnt signaling pathway, positive regulation of melanosome transport, positive regulation of monophenol monooxygenase activity, regulation of insulin-like growth factor receptor signaling pathway, positive regulation of secondary metabolite biosynthetic process, regulation of melanosome transport, regulation of monophenol monooxygenase activity, regulation of timing of catagen, negative regulation of transforming growth factor beta2 production","511, 298, 454, 661, 849, 662, 667, 858, 697, 881, 884, 952, 517"
157,"brassinosteroid biosynthetic process, brassinosteroid metabolic process","60, 61"
158,"positive regulation of axonogenesis, semaphorin-plexin signaling pathway, branching involved in blood vessel morphogenesis","591, 1036, 59"
159,"biological adhesion, cell adhesion","51, 80"
160,"cellular homeostasis, cellular chemical homeostasis","110, 100"
161,"cellular lactam metabolic process, creatinine metabolic process","112, 203"
162,"positive regulation of muscle cell apoptotic process, B cell lineage commitment, cellular response to actinomycin D, DNA strand renaturation, cellular response to UV-C, glucose catabolic process to lactate, negative regulation of fermentation, oligodendrocyte apoptotic process, positive regulation of striated muscle cell apoptotic process, regulation of glycolytic process by positive regulation of transcription from RNA polymerase II promoter, regulation of NAD metabolic process, positive regulation of transcription from RNA polymerase II promoter in response to hypoxia, negative regulation of NAD metabolic process, positive regulation of cardiac muscle cell apoptotic process, glucose catabolic process to lactate via pyruvate, regulation of carbohydrate catabolic process by regulation of transcription from RNA polymerase II promoter, fermentation, glycolytic fermentation, regulation of glucose catabolic process to lactate via pyruvate, negative regulation of macromitophagy, regulation of glycolytic process by regulation of transcription from RNA polymerase II promoter, response to actinomycin D, negative regulation of glucose catabolic process to lactate via pyruvate, regulation of fermentation, T cell proliferation involved in immune response","670, 49, 125, 219, 158, 270, 446, 535, 708, 846, 892, 713, 478, 600, 271, 784, 261, 280, 844, 468, 847, 973, 451, 842, 1095"
163,"cellular response to fructose stimulus, cell differentiation involved in salivary gland development, positive regulation of plasma cell differentiation, regulation of lactation, epithelial cell differentiation involved in salivary gland development, positive regulation of transcription from RNA polymerase II promoter involved in unfolded protein response, epithelial cell maturation involved in salivary gland development, acylglycerol homeostasis, plasma cell differentiation, positive regulation of vascular wound healing, triglyceride homeostasis, positive regulation of lactation, response to insulin-like growth factor stimulus, response to fructose, regulation of vascular wound healing, regulation of plasma cell differentiation, serotonin secretion, neurotransmission","135, 86, 683, 867, 232, 716, 233, 24, 576, 719, 1110, 648, 993, 988, 966, 908, 1040"
164,"neuron projection extension involved in neuron projection guidance, positive regulation of axon extension involved in axon guidance, regulation of axon extension involved in axon guidance, positive regulation of axon guidance, regulation of axon guidance, signal clustering, axon extension involved in axon guidance","527, 587, 774, 589, 776, 1043, 46"
165,"ensheathment of neurons, myelination, axon ensheathment","228, 400, 44"
166,"anatomical structure development, developmental process","36, 213"
167,"actin-mediated cell contraction, ventricular cardiac muscle cell action potential, sodium ion transmembrane transport","16, 1117, 1068"
168,"cellular component biogenesis, cellular component assembly","103, 101"
169,"integrin activation, positive regulation of immunoglobulin biosynthetic process, negative regulation of glucose import in response to insulin stimulus, immunoglobulin biosynthetic process, regulation of immunoglobulin biosynthetic process","299, 639, 452, 290, 855"
170,"blood vessel development, vasculature development, cardiovascular system development, blood vessel morphogenesis","55, 1115, 73, 58"
171,"positive regulation of fatty acid beta-oxidation, organic acid catabolic process, amino-acid betaine metabolic process, eating behavior, positive regulation of fatty acid oxidation, carnitine metabolic process, regulation of fatty acid oxidation, positive regulation of fatty acid metabolic process, positive regulation of lipid catabolic process, regulation of fatty acid beta-oxidation, small molecule catabolic process, carboxylic acid catabolic process","633, 539, 33, 221, 635, 74, 841, 634, 652, 839, 1065, 67"
172,"endothelial cell proliferation, regulation of epithelial cell apoptotic process, endothelial cell apoptotic process, epithelial cell apoptotic process, regulation of endothelial cell apoptotic process","227, 828, 225, 230, 825"
173,"cellular carbohydrate metabolic process, inositol metabolic process, regulation of respiratory gaseous exchange, myo-inositol transport, polyol transport, polyol metabolic process","99, 294, 930, 402, 582, 581"
174,"ammonia assimilation cycle, glutamine biosynthetic process, nitrogen utilization","34, 273, 533"
175,"myelination in peripheral nervous system, peripheral nervous system axon ensheathment, Schwann cell development, central nervous system myelin maintenance, Schwann cell differentiation, sebaceous gland cell differentiation","401, 561, 1031, 163, 1032, 1033"
176,"muscle cell apoptotic process, positive regulation of membrane permeability, cardiac muscle cell apoptotic process, regulation of cardiac muscle cell apoptotic process, striated muscle cell apoptotic process, regulation of muscle cell apoptotic process, regulation of striated muscle cell apoptotic process","396, 663, 70, 785, 1082, 887, 945"
177,"cellular transition metal ion homeostasis, cellular zinc ion homeostasis, zinc ion homeostasis","161, 162, 1122"
178,"negative regulation of T cell apoptotic process, regulation of activation-induced cell death of T cells, negative regulation of activation-induced cell death of T cells, activation-induced cell death of T cells","509, 766, 405, 20"
179,"activation of signaling protein activity involved in unfolded protein response, hindbrain structural organization, cerebellum structural organization","19, 284, 165"
180,"chemokine receptor transport out of membrane raft, positive regulation of T cell mediated immune response to tumor cell, regulation of transforming growth factor beta3 production, chemokine receptor transport within lipid bilayer, negative regulation of erythrocyte aggregation, regulation of erythrocyte clearance, negative regulation of erythrocyte clearance, negative regulation of T cell homeostatic proliferation, regulation of erythrocyte aggregation, T cell homeostatic proliferation, negative regulation of transforming growth factor beta3 production, erythrocyte aggregation, positive regulation of B cell apoptotic process, protein transport out of membrane raft, regulation of T cell homeostatic proliferation, positive regulation of T cell homeostatic proliferation, regulation of T cell mediated immune response to tumor cell, transforming growth factor beta3 production, positive regulation of cell-cell adhesion mediated by integrin, T cell mediated immune response to tumor cell, erythrocyte clearance","171, 710, 963, 172, 442, 833, 443, 510, 832, 1093, 518, 242, 592, 752, 950, 709, 951, 1106, 611, 1094, 243"
181,"cellular alcohol biosynthetic process, ergosterol metabolic process, ergosterol biosynthetic process, cellular alcohol metabolic process, phytosteroid biosynthetic process, phytosteroid metabolic process","96, 241, 240, 97, 574, 575"
182,"apoptotic process, regulation of apoptotic process, regulation of programmed cell death, programmed cell death","41, 772, 913, 725"
183,"regulation of amino acid import, regulation of L-glutamate transport, glutamate reuptake, regulation of DNA-templated transcription, termination, regulation of glutamate uptake involved in transmission of nerve impulse, L-glutamate(1-) import into cell, amino acid neurotransmitter reuptake, negative regulation of DNA-templated transcription, termination, regulation of L-glutamate import, circadian regulation of translation, regulation of amino acid uptake involved in synaptic transmission, L-glutamate import into cell","768, 866, 272, 822, 845, 330, 31, 435, 865, 186, 769, 329"
184,"actin filament capping, regulation of protein depolymerization, negative regulation of protein complex disassembly, regulation of actin filament depolymerization, negative regulation of protein depolymerization, negative regulation of protein polymerization, negative regulation of cytoskeleton organization, actin filament depolymerization","12, 917, 491, 764, 493, 498, 431, 13"
185,"farnesyl diphosphate biosynthetic process, regulation of cholesterol biosynthetic process, regulation of cholesterol metabolic process","254, 811, 813"
186,"actin filament-based process, actin cytoskeleton organization","15, 11"
187,"thioester metabolic process, acetyl-CoA metabolic process, acyl-CoA metabolic process","1099, 8, 23"
188,"cellular glucose homeostasis, response to glucose, cellular response to carbohydrate stimulus, cellular response to hexose stimulus, response to hexose, response to carbohydrate, cellular response to monosaccharide stimulus, cellular response to glucose stimulus, response to monosaccharide","109, 989, 128, 138, 990, 979, 143, 137, 999"
189,"L-arginine import into cell, amino acid import across plasma membrane, L-arginine transport, amino acid import into cell, L-arginine transmembrane transport, amino acid import, nitric oxide production involved in inflammatory response, arginine transmembrane transport, L-arginine import across plasma membrane, L-arginine import, arginine import, ornithine transport, lysine transport, L-amino acid import, L-lysine import into cell, L-lysine transmembrane transport, L-lysine transport, L-ornithine import across plasma membrane, L-ornithine transmembrane transport, lysine import, L-ornithine import into cell, L-lysine import across plasma membrane, amino acid transmembrane import, L-lysine import","326, 29, 328, 30, 327, 28, 532, 43, 325, 324, 42, 552, 364, 323, 333, 334, 335, 336, 338, 363, 337, 332, 32, 331"
190,"ether metabolic process, cellular lipid biosynthetic process, mononuclear cell differentiation, ether biosynthetic process, ether lipid biosynthetic process, glycerol ether biosynthetic process, glycerol ether metabolic process, monocyte differentiation, neutrophil differentiation, granulocyte differentiation, ether lipid metabolic process","248, 113, 388, 245, 246, 274, 275, 387, 530, 282, 247"
191,"acetate ester biosynthetic process, acetate ester metabolic process, acetylcholine metabolic process, ammonium ion metabolic process, choline transport, neuromuscular synaptic transmission, neurotransmitter biosynthetic process, neurotransmitter metabolic process, acetylcholine biosynthetic process, synaptic transmission, cholinergic","3, 4, 10, 35, 182, 523, 528, 529, 9, 1087"
192,"acetate biosynthetic process, sulfur compound biosynthetic process, short-chain fatty acid biosynthetic process, acetyl-CoA biosynthetic process, acetyl-CoA biosynthetic process from acetate, short-chain fatty acid metabolic process, acyl-CoA biosynthetic process, propionate biosynthetic process, propionate metabolic process, thioester biosynthetic process, coenzyme biosynthetic process, acetate metabolic process","2, 1084, 1041, 6, 7, 1042, 22, 726, 727, 1098, 192, 5"
193,"cell migration, cell motility, locomotion, localization of cell","90, 91, 358, 357"
194,"regulation of insulin secretion, peptide hormone secretion, carnitine metabolic process, eating behavior, positive regulation of fatty acid oxidation, insulin secretion, amino-acid betaine metabolic process, hormone transport, positive regulation of fatty acid beta-oxidation, positive regulation of lipid catabolic process, regulation of fatty acid beta-oxidation, hormone secretion, positive regulation of fatty acid metabolic process, regulation of fatty acid oxidation, regulation of hormone secretion, regulation of peptide hormone secretion","857, 558, 74, 221, 635, 297, 33, 288, 633, 652, 839, 287, 634, 841, 852, 898"
195,"activation of protein kinase B activity, regulation of positive chemotaxis, positive regulation of response to external stimulus, axon regeneration, regulation of sprouting of injured axon, negative regulation of astrocyte differentiation, positive regulation of actin cytoskeleton reorganization, positive regulation of chemotaxis, lens fiber cell differentiation, negative regulation of glial cell differentiation, regulation of axon regeneration, positive regulation of axon extension, neuron fate specification, positive regulation of positive chemotaxis, positive regulation of sprouting of injured axon, axon extension involved in regeneration, negative regulation of gliogenesis, positive regulation of axon regeneration, regulation of chemotaxis, regulation of actin cytoskeleton reorganization, positive regulation of response to wounding, regulation of axon extension involved in regeneration, regulation of neuron projection regeneration, regulation of response to wounding, positive chemotaxis, positive regulation of neuron projection regeneration, positive regulation of axon extension involved in regeneration, sprouting of injured axon","18, 911, 692, 48, 941, 408, 584, 618, 342, 448, 777, 586, 525, 686, 705, 47, 449, 590, 810, 763, 694, 775, 897, 932, 583, 675, 588, 1071"
196,"10-formyltetrahydrofolate catabolic process, dicarboxylic acid catabolic process, cellular modified amino acid catabolic process, cofactor catabolic process, folic acid-containing compound catabolic process, coenzyme catabolic process, dicarboxylic acid metabolic process, one-carbon metabolic process, pteridine-containing compound catabolic process, folic acid-containing compound metabolic process, pteridine-containing compound metabolic process, tetrahydrofolate metabolic process, 10-formyltetrahydrofolate metabolic process","0, 214, 119, 196, 262, 193, 215, 537, 754, 263, 755, 1097, 1"
