"Cluster","TermNames","TermIndices"
1,"striated muscle cell differentiation, regulation of striated muscle cell differentiation","1083, 946"
2,"regulation of protein localization, regulation of protein transport, regulation of establishment of protein localization, regulation of peptide transport","919, 924, 834, 900"
3,"regulation of supramolecular fiber organization, regulation of protein complex disassembly, regulation of cytoskeleton organization","947, 914, 816"
4,"regulation of astrocyte differentiation, seminal vesicle development","773, 1037"
5,"protein heterotrimerization, skin morphogenesis","737, 1062"
6,"regulation of cell projection organization, positive regulation of neuron projection development","799, 674"
7,"regulation of cell development, positive regulation of neurogenesis, regulation of neuron differentiation, positive regulation of nervous system development","793, 672, 896, 671"
8,"regulation of fatty acid biosynthetic process, positive regulation of ligase activity","840, 650"
9,"positive regulation of cytokine secretion, positive regulation of epithelial cell apoptotic process, positive regulation of endothelial cell apoptotic process","621, 627, 625"
10,"positive regulation of cell projection organization, positive regulation of neuron projection development","609, 674"
11,"positive regulation of cell development, positive regulation of neurogenesis, regulation of neuron differentiation, positive regulation of nervous system development","605, 672, 896, 671"
12,"organic hydroxy compound biosynthetic process, sterol biosynthetic process","543, 1074"
13,"neuroblast proliferation, regulation of neuroblast proliferation, positive regulation of leukocyte apoptotic process, negative regulation of neuroblast proliferation, positive regulation of lymphocyte apoptotic process, negative regulation of stem cell proliferation, regulation of tissue remodeling, negative regulation of neural precursor cell proliferation","520, 894, 649, 481, 657, 505, 953, 480"
14,"negative regulation of endothelial cell apoptotic process, signal clustering","438, 1043"
15,"negative regulation of cell cycle G1/S phase transition, regulation of cell cycle G1/S phase transition, regulation of tissue remodeling, negative regulation of cell cycle phase transition","416, 791, 953, 417"
16,"negative regulation of homeostatic process, regulation of leukocyte apoptotic process, lymphocyte homeostasis, lymphocyte apoptotic process, regulation of lymphocyte apoptotic process, T cell homeostasis, leukocyte homeostasis, leukocyte apoptotic process","455, 868, 362, 361, 878, 1092, 344, 343"
17,"response to ischemia, lactate metabolic process","996, 339"
18,"isoprenoid metabolic process, isoprenoid biosynthetic process","321, 320"
19,"farnesyl diphosphate metabolic process, farnesyl diphosphate biosynthetic process","255, 254"
20,"single-organism catabolic process, lipid catabolic process","1048, 346"
21,"positive regulation of epithelial cell proliferation, regulation of epithelial cell proliferation, epithelial cell proliferation","628, 830, 235"
22,"early endosome to late endosome transport, negative regulation of receptor catabolic process","220, 500"
23,"response to osmotic stress, T cell homeostasis, regulation of T cell apoptotic process, T cell apoptotic process, leukocyte apoptotic process, negative regulation of leukocyte apoptotic process, lymphocyte apoptotic process, regulation of lymphocyte apoptotic process, regulation of leukocyte apoptotic process","1007, 1092, 949, 1091, 343, 464, 361, 878, 868"
24,"seminal vesicle epithelium development, post-mating behavior, plasminogen activation, mating plug formation, single-organism reproductive behavior, dense core granule biogenesis","1038, 721, 578, 375, 1057, 207"
25,"circadian rhythm, regulation of circadian rhythm","187, 815"
26,"lipid storage, cholesterol storage","353, 179"
27,"vacuolar transmembrane transport, positive regulation of protein refolding, regulation of protein refolding, positive regulation of mRNA processing, chaperone-mediated autophagy translocation complex disassembly, positive regulation of protein folding, lysosomal membrane organization, late endosomal microautophagy, regulation of protein complex stability, positive regulation of lysosomal membrane permeability, protein targeting to lysosome involved in chaperone-mediated autophagy, regulation of lysosomal membrane permeability, protein targeting to vacuole involved in autophagy, chaperone-mediated protein transport involved in chaperone-mediated autophagy","1114, 689, 921, 668, 167, 687, 365, 340, 915, 658, 750, 879, 751, 168"
28,"negative regulation of striated muscle cell apoptotic process, regulation of protein refolding, vacuolar transmembrane transport, positive regulation of protein refolding, chaperone-mediated autophagy translocation complex disassembly, positive regulation of protein folding, lysosomal membrane organization, late endosomal microautophagy, regulation of protein complex stability, positive regulation of lysosomal membrane permeability, protein targeting to lysosome involved in chaperone-mediated autophagy, regulation of lysosomal membrane permeability, protein targeting to vacuole involved in autophagy, chaperone-mediated protein transport involved in chaperone-mediated autophagy","506, 921, 1114, 689, 167, 687, 365, 340, 915, 658, 750, 879, 751, 168"
29,"cerebral cortex neuron differentiation, seminal vesicle morphogenesis, prostate gland stromal morphogenesis","166, 1039, 728"
30,"response to endoplasmic reticulum stress, response to transforming growth factor beta, cellular response to transforming growth factor beta stimulus, negative regulation of transforming growth factor beta receptor signaling pathway, negative regulation of cellular response to transforming growth factor beta stimulus, cellular response to glucose starvation","985, 1020, 154, 516, 428, 136"
31,"steroid biosynthetic process, secondary alcohol biosynthetic process, cholesterol biosynthetic process","1072, 1034, 173"
32,"regulation of B cell differentiation, regulation of plasma cell differentiation, serotonin secretion, neurotransmission, regulation of vascular wound healing, response to fructose, response to insulin-like growth factor stimulus, positive regulation of lactation, epithelial cell maturation involved in salivary gland development, positive regulation of transcription from RNA polymerase II promoter involved in unfolded protein response, positive regulation of plasma cell differentiation, regulation of lactation, epithelial cell differentiation involved in salivary gland development, cellular response to fructose stimulus, positive regulation of vascular wound healing, plasma cell differentiation, cell differentiation involved in salivary gland development","778, 908, 1040, 966, 988, 993, 648, 233, 716, 683, 867, 232, 135, 719, 576, 86"
33,"muscle adaptation, cardiac muscle hypertrophy","395, 72"
34,"cellular component maintenance, negative regulation of receptor catabolic process","105, 500"
35,"positive regulation of endothelial cell proliferation, blood vessel endothelial cell proliferation involved in sprouting angiogenesis","626, 56"
36,"isopentenyl diphosphate biosynthetic process, mevalonate pathway, isopentenyl diphosphate metabolic process, isopentenyl diphosphate biosynthetic process","318, 319, 317"
37,"cell cycle arrest, positive regulation of cell cycle arrest, mitotic cell cycle arrest","81, 604, 384"
38,"oxidative stress-induced premature senescence, B cell lineage commitment, response to actinomycin D, regulation of glycolytic process by regulation of transcription from RNA polymerase II promoter, regulation of glucose catabolic process to lactate via pyruvate, regulation of carbohydrate catabolic process by regulation of transcription from RNA polymerase II promoter, positive regulation of transcription from RNA polymerase II promoter in response to hypoxia, oligodendrocyte apoptotic process, T cell proliferation involved in immune response, regulation of fermentation, negative regulation of glucose catabolic process to lactate via pyruvate, regulation of NAD metabolic process, regulation of glycolytic process by positive regulation of transcription from RNA polymerase II promoter, negative regulation of NAD metabolic process, glucose catabolic process to lactate via pyruvate, fermentation, negative regulation of macromitophagy, negative regulation of fermentation, glucose catabolic process to lactate, cellular response to UV-C, cellular response to actinomycin D, DNA strand renaturation, glycolytic fermentation","555, 49, 973, 847, 844, 784, 713, 535, 1095, 842, 451, 892, 846, 478, 271, 261, 468, 446, 270, 158, 125, 219, 280"
39,"glial cell development, oligodendrocyte development, central nervous system myelination, axon ensheathment in central nervous system","267, 536, 164, 45"
40,"glucocorticoid mediated signaling pathway, negative regulation of microtubule polymerization or depolymerization","268, 470"
41,"long-chain fatty acid metabolic process, positive regulation of fatty acid metabolic process, regulation of fatty acid oxidation, eating behavior, positive regulation of lipid catabolic process, regulation of fatty acid beta-oxidation, positive regulation of fatty acid oxidation, carnitine metabolic process, positive regulation of fatty acid beta-oxidation, amino-acid betaine metabolic process","359, 634, 841, 221, 652, 839, 635, 74, 633, 33"
42,"alcohol biosynthetic process, sterol biosynthetic process, secondary alcohol biosynthetic process, cholesterol biosynthetic process","25, 1074, 1034, 173"
43,"ameboidal-type cell migration, tissue migration, epithelium migration, regulation of epithelial cell migration, epithelial cell migration","27, 1101, 236, 829, 234"
44,"actin filament organization, regulation of actin filament-based process, regulation of actin cytoskeleton organization","14, 765, 762"
45,"response to actinomycin D, regulation of glycolytic process by regulation of transcription from RNA polymerase II promoter, regulation of glucose catabolic process to lactate via pyruvate, response to antibiotic, cellular response to actinomycin D, regulation of carbohydrate catabolic process by regulation of transcription from RNA polymerase II promoter, positive regulation of transcription from RNA polymerase II promoter in response to hypoxia, oligodendrocyte apoptotic process, T cell proliferation involved in immune response, regulation of fermentation, negative regulation of glucose catabolic process to lactate via pyruvate, regulation of NAD metabolic process, regulation of glycolytic process by positive regulation of transcription from RNA polymerase II promoter, negative regulation of NAD metabolic process, glucose catabolic process to lactate via pyruvate, fermentation, negative regulation of macromitophagy, negative regulation of fermentation, glucose catabolic process to lactate, cellular response to UV-C, DNA strand renaturation, glycolytic fermentation, B cell lineage commitment","973, 847, 844, 976, 125, 784, 713, 535, 1095, 842, 451, 892, 846, 478, 271, 261, 468, 446, 270, 158, 219, 280, 49"
46,"visual behavior, visual learning","1120, 1121"
47,"syncytium formation, syncytium formation by plasma membrane fusion","1088, 1089"
48,"RNA import into mitochondrion, rRNA transport, rRNA import into mitochondrion","1028, 1030, 1029"
49,"response to light stimulus, response to radiation","997, 1011"
50,"response to extracellular stimulus, response to nutrient levels","986, 1003"
51,"regulation of vasoconstriction by circulating norepinephrine, ventricular cardiac muscle cell action potential, regulation of vasoconstriction by norepinephrine","968, 1117, 969"
52,"regulation of transcription from RNA polymerase II promoter, transcription from RNA polymerase II promoter","956, 1104"
53,"regulation of TOR signaling, TOR signaling","954, 1102"
54,"regulation of systemic arterial blood pressure by ischemic conditions, vasoconstriction of artery involved in ischemic response to lowering of systemic arterial blood pressure","948, 1116"
55,"regulation of Ras protein signal transduction, regulation of small GTPase mediated signal transduction","928, 939"
56,"regulation of nervous system development, regulation of neurogenesis","893, 895"
57,"regulation of metabolic process, regulation of primary metabolic process","882, 912"
58,"regulation of cell migration, regulation of cellular component movement, regulation of locomotion, regulation of cell motility","797, 802, 877, 798"
59,"regulation of cell communication, regulation of signaling","790, 937"
60,"receptor-mediated endocytosis, regulation of receptor-mediated endocytosis","760, 929"
61,"Ras protein signal transduction, small GTPase mediated signal transduction","759, 1063"
62,"Rab protein signal transduction, regulation of Rab protein signal transduction","758, 927"
63,"protein localization to cell periphery, protein localization to plasma membrane","742, 746"
64,"protein localization to axon, protein localization to paranode region of axon","741, 744"
65,"positive regulation of steroid biosynthetic process, positive regulation of steroid metabolic process, regulation of steroid biosynthetic process, regulation of steroid metabolic process","706, 707, 942, 943"
66,"positive regulation of nucleic acid-templated transcription, positive regulation of transcription, DNA-templated, positive regulation of RNA metabolic process, positive regulation of transcription from RNA polymerase II promoter, positive regulation of RNA biosynthetic process","677, 717, 696, 711, 695"
67,"positive regulation of macromolecule biosynthetic process, positive regulation of nucleobase-containing compound metabolic process, positive regulation of nitrogen compound metabolic process","659, 678, 676"
68,"positive regulation of lipid metabolic process, regulation of lipid biosynthetic process","654, 870"
69,"positive regulation of lipid localization, positive regulation of lipid storage, regulation of lipid localization","653, 655, 871"
70,"positive regulation of integrin-mediated signaling pathway, regulation of rubidium ion transport, regulation of integrin-mediated signaling pathway","641, 935, 859"
71,"positive regulation of extracellular matrix organization, regulation of extracellular matrix organization","632, 837"
72,"positive regulation of DNA-directed DNA polymerase activity, regulation of DNA-directed DNA polymerase activity","624, 820"
73,"positive regulation of cellular metabolic process, positive regulation of metabolic process","615, 664"
74,"positive regulation of cell migration, positive regulation of locomotion, positive regulation of cellular component movement, positive regulation of cell motility","607, 656, 613, 608"
75,"positive regulation of cell differentiation, positive regulation of developmental process","606, 623"
76,"positive regulation of cell communication, positive regulation of response to stimulus, positive regulation of signal transduction, positive regulation of signaling, positive regulation of intracellular signal transduction","603, 693, 700, 701, 647"
77,"polyamine transmembrane transport, putrescine biosynthetic process from ornithine, regulation of polyamine transmembrane transport, positive regulation of polyamine transmembrane transport","579, 757, 910, 685"
78,"positive regulation of establishment of protein localization, peptide secretion, positive regulation of protein transport, regulation of protein secretion, positive regulation of secretion, positive regulation of secretion by cell, protein secretion, positive regulation of protein secretion, regulation of peptide secretion, positive regulation of peptide secretion","629, 559, 691, 922, 698, 699, 749, 690, 899, 679"
79,"regulation of TORC1 signaling, TORC1 signaling, negative regulation of TORC1 signaling","955, 1103, 513"
80,"protein dephosphorylation, regulation of protein dephosphorylation, negative regulation of protein dephosphorylation","734, 916, 492"
81,"negative regulation of phosphate metabolic process, negative regulation of phosphorus metabolic process","484, 489"
82,"negative regulation of peptidyl-serine dephosphorylation, positive regulation of blood vessel endothelial cell proliferation involved in sprouting angiogenesis, regulation of blood vessel endothelial cell proliferation involved in sprouting angiogenesis, regulation of peptidyl-serine dephosphorylation, peptidyl-serine dephosphorylation","483, 598, 782, 901, 560"
83,"negative regulation of leukocyte adhesion to vascular endothelial cell, regulation of intrinsic apoptotic signaling pathway in response to DNA damage, negative regulation of leukocyte tethering or rolling, negative regulation of intrinsic apoptotic signaling pathway in response to DNA damage","463, 863, 465, 462"
84,"negative regulation of timing of catagen, positive regulation of melanin biosynthetic process, negative regulation of hair follicle maturation, negative regulation of transforming growth factor beta2 production, positive regulation of melanosome transport, regulation of hair cycle by canonical Wnt signaling pathway, positive regulation of monophenol monooxygenase activity, positive regulation of secondary metabolite biosynthetic process, regulation of melanosome transport, regulation of monophenol monooxygenase activity, negative regulation of transforming growth factor beta production, regulation of timing of catagen, regulation of transforming growth factor beta production, transforming growth factor beta production","511, 661, 454, 517, 662, 849, 667, 697, 881, 884, 515, 952, 962, 1105"
85,"negative regulation of lipoprotein lipase activity, regulation of lipase activity, regulation of lipoprotein lipase activity, negative regulation of epithelial cell apoptotic process","467, 869, 875, 440"
86,"negative regulation of cellular protein metabolic process, negative regulation of protein metabolic process","427, 496"
87,"negative regulation of cellular metabolic process, negative regulation of macromolecule metabolic process","425, 469"
88,"negative regulation of cell growth, negative regulation of growth","420, 453"
89,"negative regulation of cell communication, negative regulation of signaling, negative regulation of signal transduction","415, 504, 503"
90,"negative regulation of cell adhesion, negative regulation of cell-cell adhesion","414, 422"
91,"negative regulation of cargo loading into COPII-coated vesicle, regulation of cargo loading into COPII-coated vesicle","412, 786"
92,"negative regulation of myosin-light-chain-phosphatase activity, regulation of myosin-light-chain-phosphatase activity, negative regulation of phosphoprotein phosphatase activity, negative regulation of bicellular tight junction assembly","476, 891, 488, 409"
93,"negative regulation of apoptotic process, negative regulation of programmed cell death, negative regulation of cell death","407, 490, 418"
94,"negative regulation of angiogenesis, negative regulation of endothelial cell proliferation","406, 439"
95,"macromolecular complex assembly, protein complex biogenesis, protein complex assembly","368, 731, 730"
96,"lysosome organization, lytic vacuole organization","366, 367"
97,"long-term memory, memory","360, 378"
98,"lipid localization, lipid transport","349, 354"
99,"intestinal absorption, intestinal cholesterol absorption, lipid digestion, intestinal lipid absorption, positive regulation of intestinal absorption, positive regulation of intestinal lipid absorption, positive regulation of intestinal cholesterol absorption","301, 302, 347, 303, 644, 646, 645"
100,"inositol lipid-mediated signaling, phosphatidylinositol-mediated signaling, phosphatidylinositol 3-kinase signaling","293, 567, 565"
101,"import across plasma membrane, import into cell","291, 292"
102,"immature B cell differentiation, pre-B cell differentiation","289, 723"
103,"Golgi to plasma membrane protein transport, protein localization to phagocytic vesicle, regulation of protein localization to phagocytic vesicle, positive regulation of protein localization to phagocytic vesicle","281, 745, 920, 688"
104,"glycerophospholipid biosynthetic process, glycerolipid biosynthetic process","278, 276"
105,"fatty acid elongation, very long-chain fatty acid biosynthetic process, very long-chain fatty acid metabolic process, fatty acid elongation, saturated fatty acid","258, 1118, 1119, 259"
106,"extracellular matrix organization, extracellular structure organization","251, 252"
107,"extracellular matrix disassembly, signal clustering, regulation of extracellular matrix disassembly, positive regulation of extracellular matrix disassembly","250, 1043, 836, 631"
108,"negative regulation of exit from mitosis, extracellular matrix assembly, negative regulation of fibroblast growth factor production, positive regulation of extracellular matrix constituent secretion, regulation of extracellular matrix constituent secretion, negative regulation of cell-cell adhesion mediated by cadherin","444, 249, 447, 630, 835, 423"
109,"establishment of localization, transport","244, 1107"
110,"epithelial cell proliferation, regulation of epithelial cell proliferation, regulation of vasculature development, regulation of angiogenesis","235, 830, 967, 771"
111,"response to toxic substance, detoxification","1019, 210"
112,"dense core granule biogenesis, single-organism reproductive behavior, mating plug formation, regulation of homotypic cell-cell adhesion, seminal vesicle epithelium development, negative regulation of homotypic cell-cell adhesion, post-mating behavior","207, 1057, 375, 851, 1038, 456, 721"
113,"response to protozoan, defense response to protozoan","1010, 206"
114,"collagen-activated signaling pathway, collagen-activated tyrosine kinase receptor signaling pathway","200, 201"
115,"cognition, learning or memory","198, 341"
116,"coenzyme A metabolic process, purine nucleoside bisphosphate metabolic process, ribonucleoside bisphosphate metabolic process, nucleoside bisphosphate metabolic process","191, 756, 1027, 534"
117,"citrate transport, tricarboxylic acid transport, mitochondrial citrate transport","190, 1109, 383"
118,"citrate metabolic process, tricarboxylic acid metabolic process, oxaloacetate metabolic process","189, 1108, 553"
119,"regulation of circadian rhythm, rhythmic behavior, circadian behavior","815, 1025, 184"
120,"chromatin reprogramming in the zygote, DNA demethylation of male pronucleus","183, 218"
121,"cholesterol transport, sterol transport, regulation of cholesterol transport, regulation of sterol transport","180, 1078, 814, 944"
122,"glycerolipid metabolic process, glycerophospholipid metabolic process","277, 279"
123,"cholesterol import, intracellular sterol transport, intracellular cholesterol transport, sterol import, intracellular lipid transport","177, 307, 304, 1076, 305"
124,"cholesterol homeostasis, sterol homeostasis, lipid homeostasis","176, 1075, 348"
125,"direct ossification, skin morphogenesis, intramembranous ossification","217, 1062, 309"
126,"interleukin-6 secretion, positive regulation of metalloendopeptidase activity, chemokine (C-C motif) ligand 2 secretion, positive regulation of chemokine (C-C motif) ligand 2 secretion, positive regulation of interleukin-6 secretion, regulation of chemokine (C-C motif) ligand 2 secretion","300, 665, 170, 617, 642, 809"
127,"cellular response to unfolded protein, endoplasmic reticulum unfolded protein response, response to unfolded protein, response to topologically incorrect protein, cellular response to topologically incorrect protein","155, 224, 1021, 1018, 153"
128,"cellular response to stress, negative regulation of cell differentiation","152, 419"
129,"regulation of endothelial cell proliferation, regulation of epithelial cell migration, regulation of endothelial cell migration, endothelial cell migration","827, 829, 826, 226"
130,"cellular response to UV-A, response to UV, response to UV-A, cellular response to light stimulus, cellular response to UV","157, 1022, 1023, 141, 156"
131,"cellular response to interleukin-4, response to interleukin-4","140, 995"
132,"cellular response to interferon-beta, response to interferon-beta","139, 994"
133,"cellular response to external stimulus, cellular response to glucose starvation, negative regulation of transforming growth factor beta receptor signaling pathway, negative regulation of cellular response to transforming growth factor beta stimulus, cellular response to nutrient levels, cellular response to starvation, cellular response to extracellular stimulus, response to starvation","132, 136, 516, 428, 145, 150, 133, 1013"
134,"cellular response to chromate, response to chromate","130, 982"
135,"secondary alcohol metabolic process, sterol metabolic process, cholesterol metabolic process","1035, 1077, 178"
136,"cellular response to amino acid stimulus, response to amino acid","127, 975"
137,"cellular response to acid chemical, response to acid chemical","124, 972"
138,"cellular protein modification process, protein modification process","123, 747"
139,"cellular magnesium ion homeostasis, magnesium ion transmembrane transport, cellular response to magnesium ion","117, 372, 142"
140,"cellular macromolecule localization, cellular protein localization","116, 122"
141,"nitric oxide mediated signal transduction, detoxification of inorganic compound, response to copper ion, stress response to metal ion, detoxification of copper ion, stress response to copper ion","531, 212, 983, 1080, 211, 1079"
